{
  "$schema": "https://json-schema.org/draft/2020-12/schema",
  "$id": "https://pulse.local/schema/v0/http/showfile.schema.json",
  "title": "Local showfile",
  "type": "object",
  "additionalProperties": false,
  "required": [
    "schemaVersion",
    "revision",
    "updatedAtUtc",
    "show",
    "device",
    "channels",
    "shureReceivers"
  ],
  "properties": {
    "schemaVersion": { "const": "0" },
    "revision": { "type": "integer", "minimum": 0, "maximum": 2147483647 },
    "updatedAtUtc": { "type": ["string", "null"], "format": "date-time" },
    "show": {
      "type": "object",
      "additionalProperties": false,
      "required": ["name"],
      "properties": {
        "name": { "type": "string", "minLength": 1, "maxLength": 120 }
      }
    },
    "alertPolicy": {
      "type": "object",
      "additionalProperties": false,
      "required": [
        "batteryCautionPercent",
        "batteryCriticalPercent",
        "rfCautionDbm",
        "rfCriticalDbm",
        "qualityCautionPercent",
        "qualityCriticalPercent",
        "silenceFloorDbfs",
        "silenceAfterSeconds",
        "clipAlerts",
        "overlayExpiryMinutes"
      ],
      "properties": {
        "batteryCautionPercent": { "type": "integer", "minimum": 1, "maximum": 100 },
        "batteryCriticalPercent": { "type": "integer", "minimum": 0, "maximum": 100 },
        "rfCautionDbm": { "type": "integer", "minimum": -130, "maximum": 0 },
        "rfCriticalDbm": { "type": "integer", "minimum": -130, "maximum": 0 },
        "qualityCautionPercent": { "type": "integer", "minimum": 0, "maximum": 100 },
        "qualityCriticalPercent": { "type": "integer", "minimum": 0, "maximum": 100 },
        "silenceFloorDbfs": { "type": "integer", "minimum": -120, "maximum": 0 },
        "silenceAfterSeconds": { "type": "integer", "minimum": 5, "maximum": 3600 },
        "clipAlerts": { "type": "boolean" },
        "overlayExpiryMinutes": { "type": "integer", "minimum": 1, "maximum": 60 }
      }
    },
    "hostOutput": {
      "description": "Host monitor output feeds for this production (ADR 0031). Each feed is one shared mix that Live clients join by name; outputChannels are the 1-based channels of the node's host output device that carry it. A device channel belongs to at most one feed. Absent means the node's own single default feed.",
      "type": "object",
      "additionalProperties": false,
      "required": ["feeds"],
      "properties": {
        "feeds": {
          "type": "array",
          "maxItems": 8,
          "items": {
            "type": "object",
            "additionalProperties": false,
            "required": ["id", "name", "outputChannels"],
            "properties": {
              "id": { "type": "string", "minLength": 1, "maxLength": 64 },
              "name": { "type": "string", "minLength": 1, "maxLength": 60 },
              "outputChannels": {
                "type": "array",
                "maxItems": 8,
                "items": { "type": "integer", "minimum": 1, "maximum": 256 }
              }
            }
          }
        }
      }
    },
    "device": {
      "type": ["object", "null"],
      "additionalProperties": false,
      "required": ["name", "channelCount"],
      "properties": {
        "name": { "type": "string", "minLength": 1, "maxLength": 240 },
        "channelCount": { "type": "integer", "minimum": 1, "maximum": 128 }
      }
    },
    "shureReceivers": {
      "type": "array",
      "maxItems": 64,
      "items": {
        "type": "object",
        "additionalProperties": false,
        "required": ["id", "name", "host", "model", "channelCount"],
        "properties": {
          "id": { "type": "string", "minLength": 1, "maxLength": 64 },
          "name": { "type": "string", "minLength": 1, "maxLength": 120 },
          "host": { "type": "string", "minLength": 1, "maxLength": 45 },
          "model": {
            "enum": [
              "AD4D",
              "AD4D-DC",
              "AD4Q",
              "AD4Q-DC",
              "ANX4",
              "ULXD4",
              "ULXD4D",
              "ULXD4Q",
              "ULXD4-GV",
              "ULXD4D-GV",
              "ULXD4Q-GV",
              "QLXD4",
              "SLXD4",
              "SLXD4D",
              "SLXD4+",
              "SLXD4D+",
              "SLXD4Q+",
              "SLXD4QDAN+"
            ]
          },
          "channelCount": { "type": "integer", "minimum": 1, "maximum": 128 }
        }
      }
    },
    "sennheiserReceivers": {
      "description": "Sennheiser EW-DX EM 2 Dante receivers read over authenticated SSCv2 (firmware 4.0.0 and later). Ids share one namespace with shureReceivers, so a channel's shureReceiverId/shureChannelIndex may name either. The third-party password is an audio-node secret and never appears here. Absent means none.",
      "type": "array",
      "maxItems": 64,
      "items": {
        "type": "object",
        "additionalProperties": false,
        "required": ["id", "name", "host", "model", "channelCount", "tlsCertificateSha256"],
        "properties": {
          "id": { "type": "string", "minLength": 1, "maxLength": 64 },
          "name": { "type": "string", "minLength": 1, "maxLength": 120 },
          "host": { "type": "string", "minLength": 1, "maxLength": 45 },
          "model": { "enum": ["EW-DX EM 2 Dante"] },
          "channelCount": { "const": 2 },
          "tlsCertificateSha256": {
            "description": "Lower-case hex SHA-256 fingerprint of the receiver's TLS certificate (the backend rejects anything but 64 hex digits). The node refuses to send credentials to any other certificate.",
            "type": "string",
            "minLength": 64,
            "maxLength": 64
          }
        }
      }
    },
    "channels": {
      "type": "array",
      "maxItems": 128,
      "items": {
        "type": "object",
        "additionalProperties": false,
        "required": ["inputIndex", "name"],
        "properties": {
          "id": { "type": "string", "minLength": 1, "maxLength": 64 },
          "inputIndex": {
            "type": ["integer", "null"],
            "minimum": 0,
            "maximum": 127
          },
          "name": { "type": "string", "minLength": 1, "maxLength": 120 },
          "performer": { "type": ["string", "null"], "maxLength": 120 },
          "shureChannelIndex": {
            "type": ["integer", "null"],
            "minimum": 0,
            "maximum": 127
          },
          "shureReceiverId": {
            "type": ["string", "null"],
            "minLength": 1,
            "maxLength": 64
          },
          "trimDb": {
            "description": "Monitor trim in dB, applied to this channel's input before the operator's level and before any host output feed. Absent means 0. It never changes meters, alerts or the captured audio.",
            "type": "number",
            "minimum": -24,
            "maximum": 24
          },
          "micType": {
            "enum": [
              "lavalier",
              "headset",
              "handheld",
              "beltpack",
              "boundary",
              "instrument",
              "other",
              null
            ]
          },
          "imageUrl": {
            "type": ["string", "null"],
            "minLength": 1,
            "maxLength": 300000
          },
          "rooms": {
            "description": "The rooms this channel belongs to, each with its own category in that room (ADR 0035). Absent or empty means no room.",
            "type": "array",
            "maxItems": 8,
            "items": {
              "type": "object",
              "additionalProperties": false,
              "required": ["roomId", "categoryId"],
              "properties": {
                "roomId": { "type": "string", "minLength": 1, "maxLength": 64 },
                "categoryId": {
                  "type": ["string", "null"],
                  "minLength": 1,
                  "maxLength": 64
                }
              }
            }
          },
          "monitor": {
            "type": "object",
            "additionalProperties": false,
            "required": ["battery", "rf", "audio"],
            "properties": {
              "battery": { "type": "boolean" },
              "rf": { "type": "boolean" },
              "audio": { "type": "boolean" }
            }
          }
        }
      }
    },
    "rooms": {
      "type": "array",
      "maxItems": 32,
      "items": {
        "type": "object",
        "additionalProperties": false,
        "required": ["name", "categories"],
        "properties": {
          "id": { "type": "string", "minLength": 1, "maxLength": 64 },
          "name": { "type": "string", "minLength": 1, "maxLength": 120 },
          "categories": {
            "type": "array",
            "maxItems": 32,
            "items": {
              "type": "object",
              "additionalProperties": false,
              "required": ["name"],
              "properties": {
                "id": { "type": "string", "minLength": 1, "maxLength": 64 },
                "name": { "type": "string", "minLength": 1, "maxLength": 120 }
              }
            }
          }
        }
      }
    },
    "sessions": {
      "type": "array",
      "maxItems": 100,
      "items": {
        "type": "object",
        "additionalProperties": false,
        "required": ["name", "startMinute", "channels"],
        "properties": {
          "id": { "type": "string", "minLength": 1, "maxLength": 64 },
          "name": { "type": "string", "minLength": 1, "maxLength": 120 },
          "roomId": {
            "description": "The room this session runs in; null or absent for channels not in any room.",
            "type": ["string", "null"],
            "minLength": 1,
            "maxLength": 64
          },
          "startMinute": {
            "description": "Scheduled start as minutes after local midnight at the venue; null when not scheduled.",
            "type": ["integer", "null"],
            "minimum": 0,
            "maximum": 1439
          },
          "channels": {
            "type": "array",
            "maxItems": 128,
            "items": {
              "type": "object",
              "additionalProperties": false,
              "required": ["channelId", "presenter"],
              "properties": {
                "channelId": { "type": "string", "minLength": 1, "maxLength": 64 },
                "presenter": { "type": ["string", "null"], "maxLength": 120 }
              }
            }
          }
        }
      }
    }
  }
}
